{
  "schema_version": 1,
  "selection_rule": "Controller selects the first dependency-ready, non-passed, non-blocked microtask after workspace-lock validation. Memory and continuity never select a repository, phase, or task.",
  "microtask_count": 126,
  "microtasks": [
    {
      "id": "BOOT-WORKSPACE-000",
      "phase_id": "P00",
      "role": "architect",
      "title": "Prove the exact Windows-port workspace and quarantine stale context",
      "objective": "Verify the lock-bound Windows target repository, prove read-only and writable roots, classify all mismatched continuity/memory as foreign, and prepare the first active assignment without inspecting another repository.",
      "dependencies": [],
      "document_routes": [
        "READ-THIS-FIRST-QWEN.txt",
        "qwen/WORKSPACE_AUTHORITY.md",
        "qwen/WRONG_WORKSPACE_RECOVERY.md",
        "qwen/STEP_BY_STEP_EXECUTION.md"
      ],
      "rag_queries": [],
      "allowed_write_roots": [
        ".forge-qwen/state/**"
      ],
      "max_files_changed": 4,
      "max_lines_changed": 250,
      "max_tool_calls": 12,
      "max_attempts": 2,
      "acceptance": [
        "workspace assertion passes from exact current root",
        "mission/run/fingerprint/target/branch recorded",
        "read-only source and instruction roots verified",
        "stale or mismatched continuity/memory is ignored",
        "ACTIVE_ASSIGNMENT and namespaced memory cursor instructions are evidenced"
      ],
      "status": "not_started",
      "evidence": [],
      "required_capabilities": [
        "filesystem",
        "shell"
      ]
    },
    {
      "id": "BOOT-TOOLS-001",
      "phase_id": "P00",
      "role": "builder",
      "title": "Discover and harmlessly verify all seven tool capabilities",
      "objective": "Bind exact LM Studio tool/plugin/function names and argument shapes, run harmless probes, and persist verified bindings.",
      "dependencies": [
        "BOOT-WORKSPACE-000"
      ],
      "document_routes": [
        "AGENTS.md",
        "qwen/TOOL_DISCOVERY.md",
        "qwen/TOOL_CAPABILITY_MAP.json",
        "qwen/TOOL_ROUTING.md"
      ],
      "rag_queries": [
        "Forge Qwen tool discovery capability bindings shell filesystem github rag-v1 js sandbox long-term memory persistent memory"
      ],
      "allowed_write_roots": [
        ".forge-qwen/state/**"
      ],
      "max_files_changed": 4,
      "max_lines_changed": 250,
      "max_tool_calls": 18,
      "max_attempts": 3,
      "acceptance": [
        "all visible tools enumerated",
        "seven capabilities bound or exact missing blockers recorded",
        "harmless probes evidenced",
        "tool-bindings schema valid"
      ],
      "status": "not_started",
      "evidence": [],
      "required_capabilities": [
        "shell",
        "filesystem",
        "github",
        "rag_v1",
        "js_sandbox",
        "long_term_memory",
        "persistent_memory"
      ]
    },
    {
      "id": "P00-A",
      "phase_id": "P00",
      "role": "builder",
      "title": "Validate package/source hashes and state",
      "objective": "Validate package/source hashes and state",
      "dependencies": [
        "BOOT-TOOLS-001"
      ],
      "document_routes": [
        "AGENTS.md",
        "qwen/MICROTASK_PROTOCOL.md",
        "qwen/TOOL_ROUTING.md",
        "qwen/RAG_PLAYBOOK.md",
        "governance/PORT_TASK_CONTRACT.json",
        "architecture/TARGET_ARCHITECTURE.md",
        "architecture/FORSETTI_MODULES.md",
        "docs/WINDOWS_TOOLCHAIN.md"
      ],
      "rag_queries": [
        "Forge Conductor P00 Package integrity and governing intake Validate package/source hashes and state macOS source Forsetti Windows target audit evidence"
      ],
      "allowed_write_roots": [
        "src/**",
        "include/**",
        "modules/**",
        "products/**",
        "tests/**",
        "scripts/**",
        "packaging/**",
        "docs/**",
        ".forsetti/**",
        ".forge-qwen/**"
      ],
      "max_files_changed": 5,
      "max_lines_changed": 400,
      "max_tool_calls": 18,
      "max_attempts": 3,
      "acceptance": [
        "required source/governance evidence verified",
        "implementation or declared source-only output complete",
        "focused build/test/validation passes",
        "evidence and handoff recorded"
      ],
      "status": "not_started",
      "evidence": [],
      "required_capabilities": [
        "filesystem",
        "shell",
        "js_sandbox",
        "rag_v1",
        "persistent_memory"
      ]
    },
    {
      "id": "P00-B",
      "phase_id": "P00",
      "role": "builder",
      "title": "Read governing rules and task contract",
      "objective": "Read governing rules and task contract",
      "dependencies": [
        "P00-A"
      ],
      "document_routes": [
        "AGENTS.md",
        "qwen/MICROTASK_PROTOCOL.md",
        "qwen/TOOL_ROUTING.md",
        "qwen/RAG_PLAYBOOK.md",
        "governance/PORT_TASK_CONTRACT.json",
        "architecture/TARGET_ARCHITECTURE.md",
        "architecture/FORSETTI_MODULES.md",
        "docs/WINDOWS_TOOLCHAIN.md"
      ],
      "rag_queries": [
        "Forge Conductor P00 Package integrity and governing intake Read governing rules and task contract macOS source Forsetti Windows target audit evidence"
      ],
      "allowed_write_roots": [
        "src/**",
        "include/**",
        "modules/**",
        "products/**",
        "tests/**",
        "scripts/**",
        "packaging/**",
        "docs/**",
        ".forsetti/**",
        ".forge-qwen/**"
      ],
      "max_files_changed": 5,
      "max_lines_changed": 400,
      "max_tool_calls": 18,
      "max_attempts": 3,
      "acceptance": [
        "required source/governance evidence verified",
        "implementation or declared source-only output complete",
        "focused build/test/validation passes",
        "evidence and handoff recorded"
      ],
      "status": "not_started",
      "evidence": [],
      "required_capabilities": [
        "filesystem",
        "shell",
        "js_sandbox",
        "rag_v1",
        "persistent_memory"
      ]
    },
    {
      "id": "P00-C",
      "phase_id": "P00",
      "role": "builder",
      "title": "Create first verified handoff and baseline",
      "objective": "Create first verified handoff and baseline",
      "dependencies": [
        "P00-B"
      ],
      "document_routes": [
        "AGENTS.md",
        "qwen/MICROTASK_PROTOCOL.md",
        "qwen/TOOL_ROUTING.md",
        "qwen/RAG_PLAYBOOK.md",
        "governance/PORT_TASK_CONTRACT.json",
        "architecture/TARGET_ARCHITECTURE.md",
        "architecture/FORSETTI_MODULES.md",
        "docs/WINDOWS_TOOLCHAIN.md"
      ],
      "rag_queries": [
        "Forge Conductor P00 Package integrity and governing intake Create first verified handoff and baseline macOS source Forsetti Windows target audit evidence"
      ],
      "allowed_write_roots": [
        "src/**",
        "include/**",
        "modules/**",
        "products/**",
        "tests/**",
        "scripts/**",
        "packaging/**",
        "docs/**",
        ".forsetti/**",
        ".forge-qwen/**"
      ],
      "max_files_changed": 5,
      "max_lines_changed": 400,
      "max_tool_calls": 18,
      "max_attempts": 3,
      "acceptance": [
        "required source/governance evidence verified",
        "implementation or declared source-only output complete",
        "focused build/test/validation passes",
        "evidence and handoff recorded"
      ],
      "status": "not_started",
      "evidence": [],
      "required_capabilities": [
        "filesystem",
        "shell",
        "js_sandbox",
        "rag_v1",
        "persistent_memory"
      ]
    },
    {
      "id": "P00-V",
      "phase_id": "P00",
      "role": "validator",
      "title": "Validate P00: Package integrity and governing intake",
      "objective": "Independently validate gate G00 and phase outputs from a fresh context.",
      "dependencies": [
        "P00-C"
      ],
      "document_routes": [
        "AGENTS.md",
        "qwen/MICROTASK_PROTOCOL.md",
        "qwen/TOOL_ROUTING.md",
        "qwen/RAG_PLAYBOOK.md",
        "governance/PORT_TASK_CONTRACT.json",
        "architecture/TARGET_ARCHITECTURE.md",
        "architecture/FORSETTI_MODULES.md",
        "docs/WINDOWS_TOOLCHAIN.md",
        "plans/gates.json",
        "docs/EVIDENCE_RULES.md"
      ],
      "rag_queries": [
        "Forge Conductor G00 acceptance adversarial validation Package integrity and governing intake"
      ],
      "allowed_write_roots": [
        "tests/**",
        "docs/**",
        ".forge-qwen/**"
      ],
      "max_files_changed": 4,
      "max_lines_changed": 300,
      "max_tool_calls": 18,
      "max_attempts": 3,
      "acceptance": [
        "gate G00 evidence independently rerun",
        "adversarial or failure-path case executed",
        "decision pass request_changes or block recorded",
        "builder did not self-approve"
      ],
      "status": "not_started",
      "evidence": [],
      "required_capabilities": [
        "filesystem",
        "shell",
        "js_sandbox",
        "rag_v1",
        "persistent_memory"
      ]
    },
    {
      "id": "P01-A",
      "phase_id": "P01",
      "role": "builder",
      "title": "Discover actual Windows/VS/MSVC/SDK/CMake/vcpkg/WinUI tools",
      "objective": "Discover actual Windows/VS/MSVC/SDK/CMake/vcpkg/WinUI tools",
      "dependencies": [
        "BOOT-TOOLS-001",
        "P00-V"
      ],
      "document_routes": [
        "AGENTS.md",
        "qwen/MICROTASK_PROTOCOL.md",
        "qwen/TOOL_ROUTING.md",
        "qwen/RAG_PLAYBOOK.md",
        "governance/PORT_TASK_CONTRACT.json",
        "architecture/TARGET_ARCHITECTURE.md",
        "architecture/FORSETTI_MODULES.md",
        "docs/WINDOWS_TOOLCHAIN.md"
      ],
      "rag_queries": [